,review_code,place_code,ItemID,UserID,review,Rating,Timestamp
0,DDM000001,STORE_DDM0001,광고동래복국 동대문점,qjajg0,최악임 27천원이나 하는 민어탕 맛이 없어 먹다 남겼음,1,2021.06.26.
1,DDM000002,STORE_DDM0001,광고동래복국 동대문점,17eigv0,NaN,4,2021.06.12.
2,DDM000003,STORE_DDM0001,광고동래복국 동대문점,16prq3m,회사 직원들이랑 복지리탕 먹었는데 간만에 제대로 된 점심 먹은것같네요 ㅎㅎㅎ 든든한 한끼 잘먹었습니다 ! 매장도 깔끔해서 나중에 또 먹으러가려구요~!,5,2021.04.12.
3,DDM000004,STORE_DDM0001,광고동래복국 동대문점,102o6lf,부모님이 좋아하시네요~ 잘먹고갑니다!!,5,2021.04.09.
4,DDM000005,STORE_DDM0001,광고동래복국 동대문점,v6f131,동대문에 이런 집이!! 맛있어요^^,5,2021.04.09.
5,DDM000006,STORE_DDM0001,광고동래복국 동대문점,152gohh,교통편리하고 주차지원되고 넓직해요 서빙해주신 직원 두분 다 반찬리필도 잘해주시고 계속 심부름시켰는데도 매우 친절하셨어요 마지막까지 과일과 커피까지 먹고나니 너무 배부르네요 추천합니다 ,5,2020.07.05.
6,DDM000007,STORE_DDM0001,광고동래복국 동대문점,16ujags,방으로 예약해도 직원들 쉬어야 된다고 홀 자리로 안내해주네요 아빠 생신이라 갔던 건데 홀 시끄럽고 기분도 상하고 코스요리 음식 맛도 전체적으로 별로였습니다,1,2020.06.20.
7,DDM000008,STORE_DDM0001,광고동래복국 동대문점,157p1he,복국은 시원해야되는데 시원하지가 않다 김밥천국에서 나온 복국같다  텁텁한 특유의 조미료맛도 남,2,2020.01.01.
8,DDM000009,STORE_DDM0001,광고동래복국 동대문점,1500goo,손님에게 예약처리 잘못하고 예약확인한 고객에게 8명좌석을 급조하며 하는말이 여기12인석이니 않아서 주문하세요... 죄송하다는 말한마디 없이 .... 사장에게 항의하니 바빠서 30팀 예약못받았단다...우린 예약황닌하고 멀리주차하고 버스타고 시간마추어 도착했는데 가족망년회완전 엉망되고 기분나쁜 상태되고 사과도못받고 그사장이나 점원이나 바뿌면 손님은 안보이고 돈...,1,2019.12.22.
9,DDM000010,STORE_DDM0001,광고동래복국 동대문점,m6784j,NaN,4,2019.10.22.
10,DDM000011,STORE_DDM0001,광고동래복국 동대문점,NaN,뚝배기 복국 시원한 맛이 덜해 아쉽습니다. 복껍질 무침이 맛있습니다.,2,2018.08.08.
11,DDM000012,STORE_DDM0001,광고동래복국 동대문점,NaN,NaN,3,2018.03.17.
12,DDM000013,STORE_DDM0001,광고동래복국 동대문점,NaN,NaN,5,2017.07.09.
13,DDM000014,STORE_DDM0001,광고동래복국 동대문점,NaN,해물을 좋아하진 않는데 동래복국은 너무 맛있어서 배터지게 먹고 왔어요!^^,5,2018.03.21.
14,DDM000015,STORE_DDM0001,광고동래복국 동대문점,NaN,복집이 많지않은데 음식맛이 훌륭하네요,5,2018.03.19.
15,DDM000016,STORE_DDM0001,광고동래복국 동대문점,NaN,얼마전에 다녀온 동래복집! 가족끼리 외식하기 정말 좋은 장소이네용! 굿굿 !!!,5,2018.03.16.
16,DDM000017,STORE_DDM0001,광고동래복국 동대문점,NaN,"복국에서 낚시바늘 나왔는데, 미안하긴 한데 낚시로 잡은 물고기니까 '좋게' 생각하고 넘어가라고 하는 곳...",1,2017.01.25.
17,DDM000018,STORE_DDM0002,광고에베레스트 커리월드레스토랑,15s8m8o,대한민국에서 먹은 커리중 단연 최고,5,2021.05.30.
18,DDM000019,STORE_DDM0002,광고에베레스트 커리월드레스토랑,1k3vmfq,"Chicken makhani ,butter naan &soju ^ very delicious food , you will find easily, attach visiting card ^^",5,2021.05.29.
19,DDM000020,STORE_DDM0002,광고에베레스트 커리월드레스토랑,16prq3m,종로갈때마다 항상 가는곳~! 너무 맛있어요!! 굿굿 사장님도 센스 만점 ㅎㅎ,5,2021.05.27.
20,DDM000021,STORE_DDM0002,광고에베레스트 커리월드레스토랑,1is2f4p,3인세트메뉴을 주문햇는데 탄두리치킨과 2종류의 커리와 2종류의 난 그리고 밥 라씨등등 너무 푸짐한 음식양에  놀라고 착한 가격에 한번더 놀란 식사시간이었다. 특히 플레인난과 라씨는 정말쵝오다~ 기회가 되어 동대문에 간다면 반드시 재방문하고싶은 맛집이다.,5,2021.04.23.
21,DDM000022,STORE_DDM0002,광고에베레스트 커리월드레스토랑,1ir5ond,치킨버터마살라 커리와 파니르난을 먹었는데 가격도 착하고 환상의 맛이라 아주 만족한 시간이었다. 동대문에가면 다시한번 들러고 싶은 맛집이다. 덕분에 즐거웠네요... 번창하세요~~^^,5,2021.04.22.
22,DDM000023,STORE_DDM0002,광고에베레스트 커리월드레스토랑,lvt76a,"저렴한 가격에 저렴한 재료에요  양고기커리의 고기는 씹기힘들고 닭고기는 비린내납니다,, ",1,2021.04.21.
23,DDM000024,STORE_DDM0002,광고에베레스트 커리월드레스토랑,as9r8a,쏘쏘데스네,4,2021.01.30.
24,DDM000025,STORE_DDM0002,광고에베레스트 커리월드레스토랑,9u8vpm,맛있게 먹었어요~~ 사장님도 친절하십니다,5,2021.01.30.
25,DDM000026,STORE_DDM0002,광고에베레스트 커리월드레스토랑,a84d6u,카카오추천 수도권 100선 맛집이라고해서  방문. 네팔식70/인도식30정도의 현지맛..  개인적으로 파키스탄에 오래 주재를해서  파키스탄/인도타입의 머튼커라이를 기대하고  갔는데 이태원과 동대문주변 다른집과  비교해서 그리 권하고 싶은마음은 없음.  특히 로띠(인도식으로는 난이라함)를 한장에2500원을 ..추가주문에 2500원.. 주사위 만한 큐빅양고기몇점...,2,2020.08.06.
26,DDM000027,STORE_DDM0002,광고에베레스트 커리월드레스토랑,14q1gj2,커리소스가 맛있어요 ㅎㅎ,5,2020.07.20.
27,DDM000028,STORE_DDM0002,광고에베레스트 커리월드레스토랑,11tc6e4,종로 갈 때 마다 여기서 커리먹고 가요 ㅠㅠ  커리도 난도 너므너므 맛있어용 ㅠㅠ,5,2020.06.26.
28,DDM000029,STORE_DDM0002,광고에베레스트 커리월드레스토랑,gbuc0b,진짜 진짜 개~~~~ 맛있어요 가격도 저렴한데 양이 많아서 진짜 배부르게 먹고 왔습니다 ㅠㅜ 직원분들도 친절하시고 여러모로 완벽했어요 또 갈거에요 너무 맛있어서 며칠동안 계속 생각나네요 ,5,2019.12.25.
29,DDM000030,STORE_DDM0002,광고에베레스트 커리월드레스토랑,115l0ee,"4인세트를 주문했는데 요거트음료인 라씨와 탄두리, 난과 커리를 모두 맛볼수 있어서 너무 좋았어요. 장소도 깨끗하고 음식도 깔끔해요. 넓은 창도 있어서 창밖풍경을 감상하면서 이국의 음식을 먹으니 즐겁고 난의 크기가 대박이에요. 너무 맛있어 난을 몇개 더 추가해서 먹었어요.  에베레스트커리월드 추천 추천~~~",5,2019.06.25.
30,DDM000031,STORE_DDM0002,광고에베레스트 커리월드레스토랑,f65o42,커리도 난도 너무너무 달아요...,2,2019.04.23.
31,DDM000032,STORE_DDM0002,광고에베레스트 커리월드레스토랑,vacl6c,세상 젤 맛있어용ㅎㅡㅎ,5,2019.03.27.
32,DDM000033,STORE_DDM0002,광고에베레스트 커리월드레스토랑,n36lu4,NaN,4,2019.02.16.
33,DDM000034,STORE_DDM0002,광고에베레스트 커리월드레스토랑,kep31f,여기 그냥 조온나 맛있음,5,2019.01.19.
34,DDM000035,STORE_DDM0002,광고에베레스트 커리월드레스토랑,becdf2,NaN,5,2018.08.11.
35,DDM000036,STORE_DDM0002,광고에베레스트 커리월드레스토랑,kr9d9i,양 많고 가격 적당하고 맛있음.,5,2018.01.16.
36,DDM000037,STORE_DDM0002,광고에베레스트 커리월드레스토랑,e4jqmu,6년째 단골. 갈때마다 흡족합니다. 현지느낌 물씬 좋아요~~,5,2017.09.16.
37,DDM000038,STORE_DDM0002,광고에베레스트 커리월드레스토랑,NaN,NaN,5,2018.02.05.
38,DDM000039,STORE_DDM0002,광고에베레스트 커리월드레스토랑,NaN,한가할땐 최고인데 사람많을땐 또 별로였음... 요새 유명해진거 같아서 못감ㅠㅠ,4,2017.04.22.
39,DDM000040,STORE_DDM0002,광고에베레스트 커리월드레스토랑,NaN,NaN,5,2016.10.05.
40,DDM000041,STORE_DDM0002,광고에베레스트 커리월드레스토랑,NaN,NaN,4,2016.09.11.
41,DDM000042,STORE_DDM0002,광고에베레스트 커리월드레스토랑,NaN,2인이 가서 치킨티카머설라/모듬야채커리/버터난/갈릭난/인도식밥/망고라시 먹고 왔습니다. 네팔식 커리가 익히 먹던 한국식커리보다 향도 강하고 알싸함?이라고 해야 할까요? 암튼 맛있게 잘 먹고 왔네요 라시는 강츄합니다..일반 플레인요거트랑 비슷하네요,4,2016.09.08.
42,DDM000043,STORE_DDM0002,광고에베레스트 커리월드레스토랑,NaN,가성비 최고. 본토맛에 가까운 훌륭한 음식. ,5,2016.07.07.
43,DDM000044,STORE_DDM0002,광고에베레스트 커리월드레스토랑,NaN,양많고 맛있음,5,2016.06.11.
44,DDM000045,STORE_DDM0002,광고에베레스트 커리월드레스토랑,NaN,에베레스트커리월드2인세트를 먹었는데 너무 맛있었어요. 탄두리와 시원한 맥주의 조합은 진리지요 스페셜 버터난을 서비스로 주셨는데 고소한 맛이 일품이었어요. 또한 비닥이며 테이블이 너무 깨끗해 주인부부의 성품을 알수 있는것 같아요 창밖을볼수 있는 넓은 창도 맘에 쏙 듭니다  ,5,2018.08.03.
45,DDM000046,STORE_DDM0002,광고에베레스트 커리월드레스토랑,NaN,"커리와 난, 탄두리는 이상스레 중독성이 있나봅니다. 가끔씩 생각나네요. 최근에 주인이 바뀌었는데 음식이 맛있더군요. 시간이 넉넉하시다면 파스타면을 매콤하게 볶은 짜오면도 추천합니다.",5,2016.10.13.
46,DDM000047,STORE_DDM0002,광고에베레스트 커리월드레스토랑,NaN,양이좀적고 별써비스가 없음 . 주문하면 단지 가져다 주는 수준. 그저그럼. 가격대는 양에비해서 비산수준. 위치도 그렇고.,3,2015.10.29.
47,DDM000048,STORE_DDM0002,광고에베레스트 커리월드레스토랑,NaN,매장 깔끔하고 조용하네요~ 커리랑 탄두리랑 난 시켜먹었는데 맛있었어요~,5,2011.09.09.
48,DDM000049,STORE_DDM0003,나정순할매쭈꾸미,qj7a80,NaN,4,2021.07.24.
49,DDM000050,STORE_DDM0003,나정순할매쭈꾸미,fkjqpd,다음 날 동고통받아도 자꾸 생각나는 집 ㅠㅠㅠㅠ,5,2021.07.21.
50,DDM000051,STORE_DDM0003,나정순할매쭈꾸미,13hmr9t,너무 매워... 하지만 자꾸 생각나는걸 어떡해ㅠㅠ,4,2021.07.20.
51,DDM000052,STORE_DDM0003,나정순할매쭈꾸미,enjn95,진짜 개맛있음 맛잇게 맵고 쫠깃한쭈꾸미 양도 진짜많음 주마다 가고싶음 ;; ,5,2021.07.16.
52,DDM000053,STORE_DDM0003,나정순할매쭈꾸미,13d7km7,쭈꾸미 좋아해서 여기저기 다 먹어봤는데 여기가 제일 맛있음 집도 먼데 주기적으로 감 다만 별관 직원분들 너무너무 불친절 하심ㅎㅎ 항상 본인들끼리 큰소리 내고 싸우고 눈치보여서 밥을 못 먹겠음... 전엔 브레이크타임쯤 갔더니 계속 투덜거리고 눈치 줘서 후다닥 먹고 나옴. 이런적이 한두번이 아님;; 이왕이면 본관에서 드세요~,3,2021.07.13.
53,DDM000054,STORE_DDM0003,나정순할매쭈꾸미,1louc7m,최애 쭈꾸미집..,5,2021.07.13.
54,DDM000055,STORE_DDM0003,나정순할매쭈꾸미,v6r2c0,인생쭈꾸미집. 반찬도 별거 없고 매운맛 조절도 안되는데 쭈꾸미 하나로 승부본다 특히 양념이 도른놈임; 수정: 항상 친절하신데 왜 간간히 악평이 있나 속상했었는데 너무 바쁠 때 갔더니 이해가 갔다.. 아무리 손흔들고 일어나서 불러도 힐끗 보고는  모른척하심 모두가. 솔직히 짜증났지만 워낙 바쁘고 힘들어서 그러시겠거니함,5,2021.07.13.
55,DDM000056,STORE_DDM0003,나정순할매쭈꾸미,10ivltp,나정순=쭈꾸미=존맛,5,2021.07.08.
56,DDM000057,STORE_DDM0003,나정순할매쭈꾸미,7l02p6,NaN,5,2021.07.07.
57,DDM000058,STORE_DDM0003,나정순할매쭈꾸미,nv32t5,"양이 정말 혜자고, 왜 사람이 항상 많은지 이해가되는 곳. 이모님들도 바쁘셔서 정신없는 편일텐데, 친절하신 편이라 생각해요!",5,2021.07.05.
58,DDM000059,STORE_DDM0003,나정순할매쭈꾸미,18b274j,존맛 츄베룹,5,2021.07.01.
59,DDM000060,STORE_DDM0003,나정순할매쭈꾸미,126kre5,NaN,4,2021.06.30.
60,DDM000061,STORE_DDM0003,나정순할매쭈꾸미,fkfake,NaN,3,2021.06.26.
61,DDM000062,STORE_DDM0003,나정순할매쭈꾸미,oan0q9,양많고 넘맛있어요 좀 바빠보이지만 그래두  친절하고 계속 갈거에요! 나정순할매 손녀하고싶어요 ,5,2021.06.24.
62,DDM000063,STORE_DDM0003,나정순할매쭈꾸미,vsff3b,인생 쭈꾸미 입니다.. 하루단위로 매일 먹고싶어요.. 그리고 너무 친절하십니다. ,5,2021.06.17.
63,DDM000064,STORE_DDM0003,나정순할매쭈꾸미,15t5rhr,진짜 쭈꾸미 크기부터가 남다르고 맛이야 말할게 없구요..! 이모님들도 저희 들어오자마자 먹는 방법 알려주시고 천사채 비었으면 말안해도 채워주시고 충분히 친절하십니다...! 거짓말 안치고 여기가 친구들이랑 제일 많이 간 식당인 것 같아요ㅋㅋㅋㅋ 매번 갈때마다 쭈꾸미 맛도 늘 일정하게 최고고 볶음밥도 존맛탱인데 가끔가다 보이는 악플 이해가 도무지 안가오 ㅠㅠ ...,5,2021.06.09.
64,DDM000065,STORE_DDM0003,나정순할매쭈꾸미,1d3344s,NaN,4,2021.06.04.
65,DDM000066,STORE_DDM0003,나정순할매쭈꾸미,1bvju1a,용두동 쭈꾸미 골목서 제일 ... 다른 집들이 더 맛있었음. ,1,2021.06.02.
66,DDM000067,STORE_DDM0003,나정순할매쭈꾸미,uk8llp,정겨운 이모들 얼큰하게 매워요 깻잎이랑 마늘 마요네즈 해파리랑 먹으면 괜찮아용ㅎ 보통 오래끓이면 질긴데 하나도 안질기고 꼬들하고 맛납니다!!,5,2021.05.28.
67,DDM000068,STORE_DDM0003,나정순할매쭈꾸미,7kfkk0,맛있는데 매우 매워요!! ,4,2021.05.27.
68,DDM000069,STORE_DDM0003,나정순할매쭈꾸미,1dvvuck,웨이팅 보면 얼마나 맛잇는지 알수잇음,5,2021.05.27.
69,DDM000070,STORE_DDM0003,나정순할매쭈꾸미,1ea798v,존맛탱 장사진짜잘되네요 웨이팅필수 영업시간 내에 가도 대기표 못받을 수 있음 ,5,2021.05.16.
70,DDM000071,STORE_DDM0003,나정순할매쭈꾸미,dct2he,정말 맛있는데 먹고 나면 속이 아픕니다...,4,2021.05.12.
71,DDM000072,STORE_DDM0003,나정순할매쭈꾸미,18ams69,중독성 있는 양념~ 막 맛있지는 않는데 묘하게 자꾸 생각나는집,4,2021.05.11.
72,DDM000073,STORE_DDM0003,나정순할매쭈꾸미,1cnaal3,다 먹고 포장까지 해옴 양념이 참.. 중독적 사장님도 친절하시고 직원분들이 계속 와서 봐주심,5,2021.05.07.
73,DDM000074,STORE_DDM0003,나정순할매쭈꾸미,s4ddci,별거 없을거 같은데 이상하게 자꾸 생각남,5,2021.05.04.
74,DDM000075,STORE_DDM0003,나정순할매쭈꾸미,sqg6dg,쭈꾸미집 중에 최고 볶음밥 & 서비스로 주신 된장찌개도 맛있음  주차가 불편해서 4점,4,2021.05.04.
75,DDM000076,STORE_DDM0003,나정순할매쭈꾸미,1a40pg1,종업원들의 매너를 이해할 수 없을 정도로 예의가 없습니다. 전에는 본관을 주로 이용했는데 지난 4월 30일은 4명이 갔더니 별관으로 가라고 해서 그곳을 이용했습니다.  평소 이곳을 가는 것은 뭐 특히 맛이 있어서는 아니지만 청계천하류를 가면 종종 들르던 곳인데 이제는 안가려고 합니다. 마치 자신들이 손님보다 더 우위에 있는 것처럼 군림하는 것은 있을 수 없...,1,2021.05.02.
76,DDM000077,STORE_DDM0003,나정순할매쭈꾸미,lb2f06,매운걸 좋아하는 저는 엄청 맛있게 먹은곳이에요. 깔끔한맛 때문에 자주 가요 ㅎ 매운걸 못드시면 비추. 단점이라면 일요일이 휴무라 쉬는날 못먹는다는거..ㅎㅎ,5,2021.04.26.
77,DDM000078,STORE_DDM0003,나정순할매쭈꾸미,flge7k,존맛 먹을 때마다 할머니 쭈꾸미 만들어줘서 감사하다고 외치고 옴 배가 안 불렀으면 좋겠다 생각드는 곳임 진짜,5,2021.04.23.
78,DDM000079,STORE_DDM0003,나정순할매쭈꾸미,168j2ul,NaN,4,2021.04.16.
79,DDM000080,STORE_DDM0003,나정순할매쭈꾸미,ukr1kl,맛있고 친절하셨습니다. 매번 웨이팅 보거나 리뷰보고 안갔는데 막상 가보니 친절하고 맛있었네요.,5,2021.04.09.
80,DDM000081,STORE_DDM0003,나정순할매쭈꾸미,rfheva,매콤하고 맛있어요 3인분 포장해옴 (포장이라그런가 양이 푸짐한게 마음에 듬) 사람이 많아서 그런지 넘 바빠보이셨음,5,2021.04.08.
81,DDM000082,STORE_DDM0003,나정순할매쭈꾸미,1fl6ctk,NaN,5,2021.03.28.
82,DDM000083,STORE_DDM0003,나정순할매쭈꾸미,1341df5,"웨이팅이 긴 만큼 가게도 체계를 좀 만드셨음 해요. 코로나19 인데도 좌석간 거기두기, 방역수칙 지키지도 않고 돛대기 시장이 따로 없네요. 꼭 먹어야겠다면 전화 포장해서 드시는 걸 추천하고, 서비스는 기대하지 마세요. 정신도 없고 신경도 안쓰는 분위기입니다. ",1,2021.03.21.
83,DDM000084,STORE_DDM0003,나정순할매쭈꾸미,NaN,맛있어요!~ 항상 찾아가네요,4,2021.03.20.
84,DDM000085,STORE_DDM0003,나정순할매쭈꾸미,muq5uo,할머니 오래오래 건강하세요. 저는 매워서 먼저 갑니다.쭈꾸미는 여기가 가장 맛있고 실한듯. ,5,2021.03.19.
85,DDM000086,STORE_DDM0003,나정순할매쭈꾸미,ua8un1,양념이 단 편인게 아쉽지만 맛과 양이 이만한 곳이 없습니다. 잘 먹었습니다.,4,2021.03.16.
86,DDM000087,STORE_DDM0003,나정순할매쭈꾸미,143o2r7,"쭈꾸미 코딱지만큼 내오는 다른집들 생각하면, 적어도 양적으로는 아주 풍요롭다. 양념은 아주 달고 자극적이나, 천사채가 적당히 상쇄시켜준다",4,2021.03.02.
87,DDM000088,STORE_DDM0003,나정순할매쭈꾸미,qord2m,개존맛탱  근데 먹고 나오면 옷에 냄새 엄청 나서 각오해야함!! ,5,2021.02.28.
88,DDM000089,STORE_DDM0003,나정순할매쭈꾸미,fuga1h,전맛탱 인생쭈꾸미,5,2021.02.18.
89,DDM000090,STORE_DDM0003,나정순할매쭈꾸미,125hhpt,맛 굿 서비스 보통 가격 굿,4,2021.01.31.
90,DDM000091,STORE_DDM0003,나정순할매쭈꾸미,msupdv,으악 개맛있음 으악  밑반찬이 부실하다 생각이 들 수 있지만 아니 그렇지 않아 .. 깻잎에 쭈꾸미 두어개 올리고 마요네즈에 버무린 천사채 샐러드 올리면 그야말로 천국의 맛 공기밥이나 볶음밥 시킬 때마다 된장찌개도 딸려나옴 볶음밥은 진짜 살면서 먹은 식후 볶음밥 중 제일 맛 있 었다 츄르르르릅 ,5,2021.01.02.
91,DDM000092,STORE_DDM0003,나정순할매쭈꾸미,giak7n,항상 맛있고 가격도 좋고 정신은 살짝 없음,4,2020.12.13.
92,DDM000093,STORE_DDM0003,나정순할매쭈꾸미,gesk53,데리고 가면 다 만족하는 집!!,5,2020.12.08.
93,DDM000094,STORE_DDM0003,나정순할매쭈꾸미,17o43ht,인생 맛집,5,2020.11.29.
94,DDM000095,STORE_DDM0003,나정순할매쭈꾸미,1du8k3a,"맛있는데 엄청 달아요, 된장은 갈때마다 맛이 달라여..",3,2020.11.24.
95,DDM000096,STORE_DDM0003,나정순할매쭈꾸미,lhcae2,맛있고 쭈꾸미 양도 많았지만 사이드 반찬이 되게 부실했고 쭈꾸집에서 필수적인 마요네즈나 계란찜 같은 메뉴들도 없네요. 회전율 때문에 그런 거 같습니다만 먼저 방문했던 일산점에서는 부침개도 주시고 이것저것 반찬이 많았던지라 기대가 컸기에 실망감이 좀 있네요.,3,2020.11.21.
96,DDM000097,STORE_DDM0003,나정순할매쭈꾸미,101cebe,첨 맛보고 소주 오병각이라고 외쳤지만  ㄹㅇ로 3명이서 5병먹고나온곳...무조건 재방문 ...!,5,2020.11.19.
97,DDM000098,STORE_DDM0003,나정순할매쭈꾸미,nb03qm,맛있어요 위생이 좀 별로라 별 4개,4,2020.11.13.
98,DDM000099,STORE_DDM0003,나정순할매쭈꾸미,muqlcq,용두동의 자랑. 지옥에서 올라온 시뻘건 쭈꾸미와 천국에서 내려온 새하얀 천사채를 깻잎에 싸먹으면 완벽의 삼위일체를 맛볼 수 있음.   볶음밥 먹기전에 양념들 최대한 덜어내세요.   쭈꾸미 볶을때 통마늘 이래도 되나 싶을정도로 때려 넣고 볶으세요.,5,2020.11.11.
99,DDM000100,STORE_DDM0003,나정순할매쭈꾸미,u0j7he,너무너무너무 맛있었습니다!! 불닭못먹어서 까르보 불닭먹는 맵찔인데 물이랑 주먹밥 먹어가면서 맛있게 먹었어요ㅋㅋㅋㅋㅋㅋ너무 맛있어서 정신없이 먹고 나오니까 매워서 눈물 찔끔 났어요ㅠ  볶음밥도 너무너무 맛있었습니다!  제가 갔을때 테이블도 꽉 안차고 좀 덜 바쁘셔서 그런지 친절하셨습니다! 반말하시긴 하지만 정이 있는 느낌이였어요ㅋㅋㅋ  저는 다음에 이 주변에...,5,2020.11.05.
100,DDM000101,STORE_DDM0003,나정순할매쭈꾸미,1d4ruir,"맵고 맛있습니다만 서비스를 기대하시고 가면 안됩니다. 불친절한 것도 아니지만, 친절할 틈이 없을만큼 바쁘고 잘 되는 식당이에요. ",4,2020.11.02.
101,DDM000102,STORE_DDM0003,나정순할매쭈꾸미,d7jvop,맛있어요! 줄섰어요 한 삼십분? 사람이 많아요! 친구 목소리가 안들리지만 맛있게 먹어요!,5,2020.10.30.
102,DDM000103,STORE_DDM0003,나정순할매쭈꾸미,7v48ok,"예전에 맛있는녀석들 본방보고 얼마전에 재방보면서 먹고싶어 아내랑 같이 방문했습니다.다만 매운맛에 먹을수 있을까 걱정했는데 우려에 불가했습니다..   진짜 정신없이 맛있게 먹었습니다.. 단맛,매콤,쫄깃,..지금까지 먹어본 쭈꾸미볶음중 최고였어요.거기에 매움을 달래줄 천사채,락교,주먹밥 그리고 시원하면서 깔끔한 된장찌개..굿 입니다 멀지만 안으면 자주 먹을뗀데...",5,2020.10.25.
103,DDM000104,STORE_DDM0003,나정순할매쭈꾸미,8ohind,너무 맛있어요 ㅠㅠ,5,2020.10.22.
104,DDM000105,STORE_DDM0003,나정순할매쭈꾸미,lcosiv,이 집 주꾸미는 진짜 맛있음. 하지만 다른 사람들 평처럼 식당에서 먹는 건 최악이고 포장해서 먹으면 양도 많고 서비스때문에 스트레스도 없음. 하나 꿀팁은 집에 표고 있으면 더 넣어서 먹으면 좋음. ,5,2020.10.17.
105,DDM000106,STORE_DDM0003,나정순할매쭈꾸미,1cqcqb0,최악의 서비스.  직원 너무 불친절해서 밥맛 떨어져요. 말투자체가 톡 쏘고 맛은 괜찮아도 직원 때문에 다시는 안 갈거 같습니다,1,2020.10.15.
106,DDM000107,STORE_DDM0003,나정순할매쭈꾸미,7khikg,NaN,4,2020.10.14.
107,DDM000108,STORE_DDM0003,나정순할매쭈꾸미,13trm91,맛있어요 볶음밥 필수임~~,5,2020.10.13.
108,DDM000109,STORE_DDM0003,나정순할매쭈꾸미,10l9kvj,"불판에 올라오는건 다른거 없이 쭈꾸미 뿐이라 이것저것 곁들여 먹는거 좋아하시면 비추 반찬도 깻잎, 천사채 정도가 다에요 식사메뉴도 아예 없다고 보셔야,, 대신 다른집과 비교하여 쭈꾸미 양은 많은편 개인적으로는 묵사발/콩나물 등등 곁들임이랑 같이먹는 주꾸미를 좋아해서 아쉬웠어요ㅜㅜ 양념자체는 맛있었고 직원분들도 괜찮았는데 전부 좌식이라 좀 불편했어요 재방문의...",3,2020.10.11.
109,DDM000110,STORE_DDM0003,나정순할매쭈꾸미,1a8d2vh,"정신없는 느낌이지만, 맛있어요. 자주 생각납니다. ",4,2020.10.08.
110,DDM000111,STORE_DDM0003,나정순할매쭈꾸미,16i9kt5,개인적으로 쭈꾸미 싫어하는데 그런 것 치고 맛있음. 하지만 내입에 너무 매움,2,2020.08.26.
111,DDM000112,STORE_DDM0003,나정순할매쭈꾸미,1bgn3ae,NaN,2,2020.08.26.
112,DDM000113,STORE_DDM0003,나정순할매쭈꾸미,14muae3,와 .정 .말 .맛 .있 .다,1,2020.08.23.
113,DDM000114,STORE_DDM0003,나정순할매쭈꾸미,m75eli,주문하기도 전에 머릿수 맞춰서 쭈꾸미 가져오시네요.ㅠㅠ 주차는 어렵고 공기밥 시키면 된장찌게 줍니다. 맛은 그닥. 조금 매운편이라 매운거 좋아하시면 추천.. 사람 많은 이유는 가격대비 쭈꾸미(수입산)를 많이 줘서인듯 다른건 별로,3,2020.08.21.
114,DDM000115,STORE_DDM0003,나정순할매쭈꾸미,ss9gsn,짱맛 또갈게용,5,2020.08.19.
115,DDM000116,STORE_DDM0003,나정순할매쭈꾸미,11s1gn8,NaN,5,2020.08.12.
116,DDM000117,STORE_DDM0003,나정순할매쭈꾸미,15e0huo,맛은 진짜 맛있어요 다만 위생이.. ,4,2020.08.11.
117,DDM000118,STORE_DDM0003,나정순할매쭈꾸미,sikg7o,맛있게 먹고 기분 나쁘게 나오고 싶으면 추천하는 곳. 재방문 의사 0 관리못해서 새치기는 예사에 음식 옷에 엎고 집게 탓하고  더위 잘 타고 추위강한 편인데도 한 여름에 감기 걸리겠네요 에어컨 올려달라니까 올렸다고 거짓말하고(추워서 에어컨 계속 보고 있었음.) 줄 없어도 다신 안 갈래요,1,2020.08.08.
118,DDM000119,STORE_DDM0003,나정순할매쭈꾸미,18sq2ci,이 가격에 이 주꾸미 볶음은 찾을 수 없을 것이다. 별 것 아닌 양념에 묘한 마성이 있다. 매운 음식 안 좋아하는 사람들은 가지 마세요. 안 맞는 음식은 굳이 가서 먹지 않는게 맞고 개인 평점 또한 극히 낮은 게 당연합니다.,5,2020.08.02.
119,DDM000120,STORE_DDM0003,나정순할매쭈꾸미,ap9m90,맵맛맵ㅅ♥,5,2020.07.26.
